TF,tier,rationale,liver_fibrosis_literature,druggability,key_reference
ARID1A,1,"HEADLINE CANDIDATE (re-verified). No liver fibrosis/HSC literature found even after deeper 2024-2025-targeted search (only liver cancer/tumorigenesis context). Same SWI/SNF/BAF complex as SMARCA4 (our #1 hit, independently validated as HSC-myofibroblast driver in 2023) - mechanistically justified 'unstudied partner of a validated hit' logic. Complex-level ATPase inhibitors (FHD-286-class) already in clinical development.",None (liver fibrosis); some in liver cancer,Indirect via BAF-complex inhibitors (FHD-286 class, though paused in AML for toxicity),"Li et al., Cell Death Dis 2023 (SMARCA4); FHD-286 J Med Chem 2024"
THAP11,1,"Strongest statistical signal among fully novel candidates (#8 combined). Re-verified: essentially zero fibrosis literature anywhere, liver or otherwise. Poor known druggability (THAP zinc-finger DBD, no known inhibitor) - mechanistic hypothesis-generation candidate, not yet translatable without more basic characterization.",None found,Poor - no known inhibitor,-
NUPR1,1,"Re-verified: NUPR1's OWN role in liver fibrosis not directly published (only found as general 'ferroptosis repressor' background cited in an HSC-ferroptosis paper about a different axis, MafG/MYH9-LCN2). Cross-organ lung angle (down in IPF, cytoprotective) has a direction mismatch vs our liver data (up with progression) that needs reconciling. Existing inhibitor (ZZW-115) already exists from HCC research.",Indirect/inferential only,Yes - ZZW-115 inhibitor already exists (tested in HCC, not fibrosis),"Ferroptosis: Cell Death Discov 2021; HSC-ferroptosis: Cell Death Differ 2024"
MEOX1,2,"DISQUALIFIED as novel candidate - re-verification found MEOX1 already published directly in liver: MEOX1 activates HSCs via SERPINE1/CTGF and promotes MASH-related fibrosis (2025 papers). Originally proposed based on a cardiac-fibrosis paper without checking liver literature deeply enough - correcting the record. Still valuable as strong evidence the pipeline recovers very recent (2025) true positives.",Strong (2025, direct MASH/HSC papers),Emerging (same TF class as cardiac fibrosis work),"PLOS Genetics 2025; SAGE 2025 MASH-fibrosis paper; Alexanian et al. 2021 (cardiac origin)"
MEOX2,2,"MEOX1 paralog - same disqualification logic applies pending a dedicated MEOX2-liver check, but grouped with MEOX1 as validated-pathway evidence rather than a novel target.",Likely similar to MEOX1 (not individually re-checked),Same class as MEOX1,"see MEOX1"
NR2C2,2,"DISQUALIFIED as novel candidate - re-verification found NR2C2/TR4 already published in liver: increased in BDL-induced rat fibrotic liver, activates HSCs via TGF-b receptor I/Smad2/3 signaling. Correcting earlier assessment.",Established (BDL model, TGF-b/Smad2/3 axis),Nuclear receptor class - plausible,"Annals of Hepatology (TR4/HSC/TGF-b paper)"
SMARCA4,2,"Already validated: dedicated 2023 paper shows BRG1/SMARCA4 drives HSC-myofibroblast transition, KO attenuates fibrosis in multiple mouse models. Confirms pipeline recovers true positives. FHD-286-class inhibitors exist but hit AML clinical hold (repurposing risk).",Strong (2023, direct),Yes - FHD-286 (BRG1/BRM ATPase inhibitor, clinical stage),"Li et al., Cell Death Dis 2023"
EP300,2,"Multiple existing p300 inhibitor liver fibrosis papers (A-485, C646) already tested directly in HSC/liver models. Strong existing translatability, less novel as headline finding.",Strong,Yes - A-485, C646 (existing chemical probes)
PIN1,2,"Serum PIN1 already shown to correlate with human NASH fibrosis stage; juglone (PIN1 inhibitor) already tested in DMN liver fibrosis model. Well-established target, low specificity of existing inhibitor is the gap.",Strong (NASH-specific),Yes - juglone (low specificity, more specific inhibitors needed),"MDPI Cells 2019; PMC3531766"
HIPK2,2,"Knockdown already shown to attenuate TGF-b1/Smad3-driven HSC activation in liver (2016). Kinases are the most druggable target class generally, but no HIPK2-specific inhibitor tested in liver yet - translational gap worth filling.",Established (2016),Kinase class - plausible, no liver-specific inhibitor yet,"Kong et al. 2016 (PMID 27890429)"
KLF2,2,"Statins already shown to activate KLF2 in liver sinusoidal endothelial cells as an anti-fibrotic mechanism - existing approved-drug repurposing angle, clinically actionable now.",Strong,Yes - statins (approved, repurposing),"Marrone et al. (LSEC/KLF2 literature)"
VDR,2,"One of the most validated anti-fibrotic TF targets in liver - VDR agonists (calcipotriol/paricalcitol) deactivate HSCs (landmark Ding et al Cell 2013). Excellent positive control, but not novel.",Very strong,Yes - approved VDR agonists,"Ding et al., Cell 2013"
NOTCH1,2,"Gamma-secretase inhibitors exist; Notch/ductular reaction-fibrosis link well established in liver already.",Strong,Yes - gamma-secretase inhibitors,-
SMAD3,2,"Central TGF-b effector, extremely well studied in liver fibrosis already. Direct TF domain hard to drug, but upstream TGFBR1 inhibitors (e.g. galunisertib) exist.",Very strong (canonical),Indirect (upstream receptor inhibitors),-
SMAD6,2,"Inhibitory SMAD - decreases with progression in our data (loss of TGF-b brake), mechanistically coherent with SMAD3 increasing. Supports pathway-level rather than single-gene story.",Moderate,Indirect,-
SMAD7,2,"Same inhibitory-SMAD logic as SMAD6.",Moderate,Indirect,-
ZHX2,2,"Already has liver-specific literature (fibrosis via MMP14 suppression, NAFLD-HCC, ferroptosis) - hepatoprotective/tumor-suppressor role, so drug strategy would need to be an activator not inhibitor (harder).",Strong,Direction mismatch for typical inhibitor drug discovery,-
E2F1/E2F7/TFDP1,2,"Cell-cycle E2F family; CDK inhibitor SNS-032 (CDK9) already shown to attenuate liver fibrosis via anti-HSC-proliferation - existing repurposing angle through CDK inhibitor class rather than E2F itself.",Indirect precedent via CDK inhibitors,Yes (indirect, via CDK inhibitors),"PMC9597511 (SNS-032)"
LEF1,2,"Wnt/beta-catenin effector; pathway drugs exist (porcupine/tankyrase inhibitors, oncology); Wnt-fibrosis link well established in lung - cross-organ angle similar to MEOX1/HIPK2 but less specific evidence located yet.",Weak-moderate (liver-specific),Indirect via Wnt pathway inhibitors,-
BARX1/BARX2/HOXA11/HOXC8/HOXD3/ZIC1/NEUROD6/BHLHA15/TBPL2/SIX1/MYCN/SCX,3,"Developmental homeobox/bHLH transcription factors. Minimal characterization in adult liver fibrosis, generally poor direct druggability (no ligand-binding pocket, DNA-binding domains hard to target). Lower priority without further mechanistic grounding.",None to minimal,Poor,-
FOXP3,3,"Master Treg transcription factor - likely reflects immune-infiltrate composition shift rather than a direct hepatocyte/HSC-intrinsic signal. Flag as possible confounder; would need cell-type deconvolution before treating as a direct target.",Indirect (immune modulation),Indirect (via IL-2/Treg biology),-
SRSF2,3,"Core splicing factor, mutated in MDS/AML - generally essential/housekeeping gene, high on-target toxicity risk for direct drugging despite strong statistical signal.",None specific,Poor (essential gene, toxicity risk),-
FOSB,3,"AP-1 family member, broadly reactive stress/injury response gene - low specificity, extensive general (non-liver-specific) literature already.",General injury-response literature only,Indirect via MAPK/AP-1 pathway,-
HMGB2,3,"HMGB family relative of HMGB1 (well-known DAMP/alarmin in liver injury with existing inhibitors e.g. glycyrrhizin), but HMGB2 itself far less characterized specifically.",Minimal (HMGB1 better studied),Indirect (via HMGB-family inhibitors),-
NPM1/FOSB/BTG2/HCFC1/SSRP1/JUND/HIF1A/VHL/ING4/KAT7/TFAP2B/KLF7/KLF8/HINFP/ZBTB17/TP63/E2F1(dup)/FOXJ1,3,"Remaining consensus TFs not individually researched in this pass - either well-characterized in liver already (HIF1A, VHL - hypoxia axis, strong existing literature, lower novelty) or insufficiently characterized to prioritize without further targeted search.",Mixed / not individually checked,Mixed,-
